{
  "artifact_type": "scope_fidelity_report",
  "generated_at": "2026-05-05T20:26:52+00:00",
  "limitations": [
    "static_host_binding_check_only",
    "does_not_resolve_dns_redirects_or_ownership",
    "does_not_prove_legal_authorization",
    "does_not_execute_tools"
  ],
  "public_safety": {
    "live_target_execution": false,
    "protocol_adapter_work": false,
    "public_push": false,
    "static_analysis_only": true
  },
  "request_shape": {
    "all_hosts_detected": [
      "example.com"
    ],
    "arg_hosts_detected": [
      "example.com"
    ],
    "execution_plan_hosts_detected": [
      "example.com"
    ],
    "mismatched_hosts_detected": [],
    "request_shape_hygiene_reason": "all_detected_hosts_match_target",
    "request_shape_hygiene_source": "normalized_args+execution_plan",
    "request_shape_hygiene_status": "clean",
    "target_host_match_status": "exact"
  },
  "schema_ref": "schemas/scope_fidelity_report.v0.1.schema.json",
  "schema_version": "v0.1",
  "source_artifact": "retained_static_scope_fidelity_fixture",
  "target": "https://example.com",
  "target_host": "example.com",
  "target_in_scope": true,
  "verdict": "pass"
}
